"22669","11075386","MALAYSIA SMELTING CORPORATION BERHAD","Metal & Mining Producers","990057861","TECITY GROUP","Approved","Green","","","","","New","Elliott Rouse","1489063","Entity assets are quite exposed to precipitation stress - recommend reaching out to understand physical adaption plans given the potential flood and rain hazards that could damage smelting equipment.","","","","MALAYSIA","Existing to Bank","","Ranim Tarakji","2003718","MY","CRQ v3","","","","","1730044800","","","23/01/2024 15:09:27","24/05/2024 06:36:56"
"22769","11040704","FORMOSA PETROCHEMICAL CORPORATION","O&G Refiners and Petrochemicals","990002163","FORMOSA PLASTICS GROUP","Approved","Amber","","","","","Review","Harshvardhan V","1493184","BCA to analyse emission intensity of clent's operations to understand the actual trend. (Trend of Scope1 emissions/unit of production or revenue -- simlar for Scope 2 and Scope3 to understand the trend clearly which seems to be up and down)","","","","TAIWAN","Existing to Bank","","Dagmara Popielarczyk","1663712","TW","CRQ v3","","","","","1729958400","","","23/01/2024 18:16:12","23/04/2024 07:00:13"
"22781","11323439","SHELL PLC","O&G Producer","990010539","ROYAL DUTCH / SHELL GROUP","Approved","Amber","","","","","Review","Harshvardhan V","1493184","Subjective/Financial analysis to assess materiality of climate risk  --> refer email sent by climate advisor on this topicAlso include peer comparison while covering this topic in the BCA -- Shell currently lags behind majors in target stting","","","","NETHERLANDS (KINGDOM OF THE)","Existing to Bank","","Dagmara Popielarczyk","1663712","GB","CRQ v3","","","","","1729440000","","","23/01/2024 18:25:33","20/03/2024 11:06:35"
"22811","13630679","FRASERS PROPERTY HOLDINGS (THAILAND) CO., LTD.","CRE","990044736","T.C.C.GROUP","Approved","Green","","","","","Review","null null","null","Company has set a target to have 80% of all their owned and managed assets by 2024 being certified as green -- Please comment on this in the BCA, is the company exepcted to acheive this target by year end (please monitor). Also what is the restrition for the remaining 20% ?Is there a timelie for them as well","","","","THAILAND","Existing to Bank","","Monalisa Banerjee","1563645","TH","CRQ v3","","","","","1730073600","","","23/01/2024 20:31:42","08/05/2024 03:16:18"
"22834","11085720","PT KRAMA YUDHA TIGA BERLIAN MOTORS","Automobiles & Components","990063403","MITSUBISHI CORPORATION GROUP","Approved","Green","","","","","Review","null null","null","To confirm if the transition risk and company's emissions are being reported at Mitsubishi Corp level. Also, to confirm if Daimler Truck AG (which is the majority shareholder - 89.29% of Mitsubishi Fuso Truck & Bus Corporation) should be used for Climate Risk assessment, given that the entity (PT Krama Yudha Tiga Berlian Motors) distributes exclusively Mitsubishi Fuso-branded commercial vehicles and parts.","","","","INDONESIA","Existing to Bank","","Ewa Baran","1663704","ID","CRQ v3","","","","","1729440000","","","24/01/2024 07:22:01","27/03/2024 02:55:35"
"22858","13131729","EXPEDIA, INC.","Consumer Services","990188251","EXPEDIA GROUP","Approved","Green","","","","","Review","null null","null","Recommend outreach to client to understand if they have data / statistics on which airlines they broker for and their climate management policies, particularly from physical risk. Additionally if Expedia has insurance against potential cancellations / delays for aircraft affected by climate hazards to understand how they are hedged against climate risks.","","","","UNITED STATES OF AMERICA","Existing to Bank","","Sneha Chourasia","2001416","US","CRQ v3","","","","","1729987200","","","24/01/2024 08:50:58","04/06/2024 05:21:23"
"22911","11269352","DAESANG CORPORATION","Food, Beverage & Tobacco","990043082","DAESANG CORP","Approved","Amber","","","","","Review","null null","null","In the BCA P2, to highlight financial risks linked to the Korea ETS and report on both the emission rights freely allocated and emission levels","","","","KOREA, REPUBLIC OF","Existing to Bank","","Devika Rose Roy","2001769","null","CRQ v3","","","","","1730044800","","","24/01/2024 14:29:37","09/06/2024 23:59:54"
"22972","11326455","PERUSAHAAN PERSEROAN (PERSERO) PT PERUSAHAAN LISTRIK NEGARA","Utilities","990024451","INDONESIA GOVERNMENT","Approved","Amber","","","","","Review","Antonio Rendina","1599218","Business team is requested to add into the client’s financial projections both (i) the physical risk costs as indicated in the latest approved Climate Risk Assessment, and (ii) an estimation of the transition risk costs associated with the carbon pricing mechanism.","","","","INDONESIA","Existing to Bank","","Abhisek  Joardar","1668812","ID","CRQ v3","","","","","1729958400","","","29/01/2024 05:59:27","21/06/2024 09:44:10"
"22983","13983097","MidOcean Energy Holdings Pty Ltd","O&G Producer","","","Approved","Red","","","","","New","Antonio Rendina","1599218","To comment on the risks faced under the Safeguard Mechanism and highlight the transmission channels","","Jain, Chirag","1575987","AUSTRALIA","New to Bank","","Abhisek  Joardar","1668812","AU","CRQ v3","","","","","1729440000","","","30/01/2024 02:10:34","13/02/2024 16:53:33"
"23008","11077430","CHEVRON MALAYSIA LIMITED","Commodity Traders","990000249","CHEVRON CORPORATION","Approved","Green","","","","","Review","Elliott Rouse","1489063","Recommend conducting an analysis on where the products sol by Chevron Malaysia are produced and if there are climate policies / potential carbon costs associated with the production region and if this could increase the COGS of the products and affect demand for Chevron MY","","","","MALAYSIA","Existing to Bank","","Dagmara Popielarczyk","1663712","MY","CRQ v3","","","","","1730044800","","","01/02/2024 17:26:58","29/04/2024 09:31:31"
"23031","13788678","HISTYLE RETAIL PRIVATE LIMITED","CRE","990045986","RUNWAL GROUP","Approved","Red","","","","","Review","null null","null","Is there a plan to have the building certified once building is constructed ? please share comments in the BCA on wheher there is any risk to valuation because there are no details of whether the asset is energy efficeint or not -- LEED/Indian Green building council certifications are becoming more common in the market.","","Liu, Shuk Fan","1551380","INDIA","Existing to Bank","","null null","1666829","IN","CRQ v3","","","","","1729440000","","","02/02/2024 11:51:53","19/03/2024 17:04:35"
"23038","13904481","RENEW SOLAR POWER PRIVATE LIMITED","Utilities","","","Approved","Green","","","","","New","null null","null","To comment on (i) risks brought by a reduction in solar photovoltaic modules due to higher solar irradiation, (ii) risks faced as a result of sales of carbon certificates business","","","","INDIA","New to Bank","","Renjith  Scariah","1540001","IN","CRQ v3","","","","","1729468800","","","06/02/2024 12:06:52","22/02/2024 06:08:11"
"23047","13984189","GOLDEN AQUAMARINE INC.","T & S - Bulker Water Transport","","","Approved","Amber","","","","","New","Harshvardhan V","1493184","Please assess impact of EU ETS on the 6 vessels being financed => what % of voyages are expected to be connected to EU ports. (this information might be avilable for the vessles for last year if the are operational vessels)","","","","NORWAY","New to Bank","","Peter Jared Delaney","1665885","SG","CRQ v3","","","","","1729440000","","","09/02/2024 09:38:35","15/02/2024 01:41:49"
"23070","13985286","Vivacious Aircraft Leasing Limited","T & S - Aviation","","","Approved","Red","","","","","New","null null","null","RT to perform client outreach to understand full disclosures package from the client with regards to aviation portion of TATA business, as NTB approach limits full CTP score","","Rouse, Elliott","1489063","IRELAND","New to Bank","","Abhisek  Joardar","1668812","SG","CRQ v3","","","","","1729958400","","","16/02/2024 08:12:08","28/05/2024 14:44:30"
"23082","13665751","CHRYSAOR E&P FINANCE LIMITED","O&G Producer","990321791","CHRYSAOR HOLDINGS LIMITED","Approved","Amber","","","","","Review","Elliott Rouse","1489063","Further information/client engagement sought on the below after deal completion:1. Post deal completion, comment on emission statistics of the combined entity as well as Scope1,2,3 emission and routine flaring interim and long term targets. Both individual groups have only Scope1,2, targets whereas for the exploration O&G sector, Scope 3 downstream are most material  -- Coverage of these emissions under existing carbon policies to be assessed financially (including UK ETS)2. There is limited to no physical risk assessment done for assets acquired from Wintershall based on Wintershalll's existing ESG repoerts, please provide an assessment on these before the renewal BCA3. Client's long term strategy to reduce GHG emission intensity of its operations -- given limited diversification in the nature of business and the nature of sector","","Mundra, Piyush","1191828","UNITED KINGDOM","Existing to Bank","","Dagmara Popielarczyk","1663712","GB","CRQ v3","","","","","1729440000","","","20/02/2024 14:10:55","23/02/2024 09:34:38"
"23084","13982834","DUNCHON HYUNDAI 1ST APARTMENT REMODELING CONSORTIUM","CRE","990377382","DUNCHON HYUNDAI 1ST APARTMENT REMODELING CONSORTIUM","Approved","Amber","","","","","New","null null","null","Although there is completion guarantee from POSCO,  BCA to assess how physical riks from climate are mitigted in the absence of an insurance both during construction and also after construction  -> Eg: Iif it impacts the pre=-sale plan, and thereby haas an impact on cashflow generated for repayment of our facilty. Please note historical evidence of completion is a good mitigant but climate risk is forwqard looking, (its not a risk which was material in the past)","","","","KOREA, REPUBLIC OF","New to Bank","","null null","1666829","KR","CRQ v3","","","","","1729987200","","","21/02/2024 04:33:50","04/04/2024 07:33:40"
"23085","13984677","Shine Luna Co., Ltd.","Utilities","","","Approved","Green","","","","","New","null null","null","Given the location of the project is at extreme risk for flooding and storms as per Munich Re assessment , RM team is requested to highlight physical risk adaptation plans of the entity to mitigate these risks.","","","","TAIWAN","New to Bank","","Devika Rose Roy","2001769","TW","CRQ v3","","","","","1729440000","","","21/02/2024 06:18:44","12/03/2024 03:31:56"
"23113","13981543","SHELL PETROLEUM COMPANY LIMITED(THE)","O&G Producer","","","Approved","Amber","","","","","New","null null","null","Refer analysis on Shell plc -- Since this is a central treaury vehicle , its directly connected to the Group","","","","UNITED KINGDOM","New to Bank","","Yvonne  Jen","1600990","GB","CRQ v3","","","","","1729468800","","","05/03/2024 15:32:01","20/03/2024 11:07:08"
"23506","13988775","Mercedes-Benz Kamyon Finansman A.S.","Automobiles & Components","","","Approved","Green","","","","","New","null null","null","To highlight the second order financial risks faced by Mercedes-Benz Kamyon Finansman A.S. from physical risk amid its consumer financing role within the Group","","","","TURKIYE","New to Bank","","Elzbieta Brodzicka","2007983","GB","CRQ v3","","","","","1730073600","","","08/04/2024 07:50:09","16/04/2024 08:48:41"
"23544","","","","","","Approved","Amber","","","","","Review","null null","null","null","","","","","Existing to Bank","","Abhisek  Joardar","1668812","","CRQ v3","","","","","1730044800","","","15/04/2024 08:30:30","30/04/2024 04:12:59"
"23555","13789789","Kapstone Constructions Private Limited","CRE","990238834","RUSTOMJEE GROUP","Approved","Green","","","","","Review","null null","null","BCa to comment on how client plans to manage physical risk, and whether the extensions in the property which are being constructed are also certified Gold by IBC","","","","INDIA","Existing to Bank","","Aljaz Leva","1664889","IN","CRQ v3","","","","","1729987200","","","21/04/2024 18:55:21","12/06/2024 09:28:49"
"23825","11062853","LNAME11062853","Household & Personal Products","990000494","UNILEVER GROUP","Review by RM","Green","","","","","Review","","","null","","","","UNITED KINGDOM","Existing to Bank","","Aleksandra  Ziemlinska","2018956","GB","CRQ v3","","","","","1729209600","","","24/04/2024 11:11:21","30/08/2024 11:50:40"
"23841","11120875","AL BWARDY INVESTMENT LLC","Food, Beverage & Tobacco","990019013","AL BWARDY GROUP","Approved","Green","","","","","Review","","","null","","","","UNITED ARAB EMIRATES","Existing to Bank","","Aleksandra  Ziemlinska","2018956","AE","CRQ v3","","","","","","","","24/04/2024 12:24:19","27/04/2025 08:09:40"
"23852","11269705","HEESUNG PMTECH CORP","Utilities","990062635","HEESUNG","Approved","Green","","","","","Review","Antonio Rendina","1599218","To report in the BCA P2, any financial information regarding the impact of the Korea ETS on the client's profitability levels","","","","KOREA, REPUBLIC OF","Existing to Bank","","Aleksandra  Ziemlinska","2018956","null","CRQ v3","","","","","1729987200","","","24/04/2024 12:52:01","07/10/2024 01:18:27"
"23854","11585746","CENTRAL RETAIL CORPORATION PUBLIC COMPANY LIMITED","Food & Staples Retailing","990012725","CENTRAL GROUP.","Review by RM","Green","","","","","Review","","","null","","","","THAILAND","Existing to Bank","","Aleksandra  Ziemlinska","2018956","TH","CRQ v3","","","","","1729036800","","","24/04/2024 12:57:02","30/08/2024 13:55:05"
"23988","13715379","LNAME13715379","Utilities","990053591","KEPCO","Approved","Green","","","","","Review","null null","null","In the BCA P2, to discuss the generation efficiency levels of the plant under different scenarios and link the P90 weather considerations to potential downside risks from climate change","","","","JORDAN","Existing to Bank","","Ewa Baran","1663704","JO","CRQ v3","","","","","1729036800","","","25/04/2024 19:15:54","05/08/2024 06:02:51"
"24151","13686001","LNAME13686001","T & S - Aviation","990011789","AIR FRANCE - KLM GROUP","Approved","Red","","","","","Review","Elliott Rouse","1489063","I addition to the financial projections being developed - would ask to check the starting FCF and EBITDA balances to understand if these are in line with historic averages, or they are still muted from impact of Covid. The weak financial starting position is a key driver of the Red rating.","","Rouse, Elliott","1489063","JAPAN","Existing to Bank","","Shubham Harsh","2008896","JP","CRQ v3","","","","","1729036800","","","27/04/2024 12:09:08","17/07/2024 09:27:20"
"24181","11206569","QATAR ALUMINIUM LIMITED","Metal & Mining Producers","990060274","GOVERNMENT OF QATAR GROUP","Rejected to Maker","Green","","","","","Review","null null","null","Recommend engaging with client to understand the % energy mix used for aluminium smelting, to get a better understanding on the emissions generation and reliance on high carbon products.","","","","QATAR","Existing to Bank","","Shubham Harsh","2008896","QA","CRQ v3","","","","","1729036800","","","27/04/2024 12:25:54","05/09/2024 02:41:58"
"24201","11018555","KUEHNE & NAGEL LIMITED","Transportation and Storage","990002233","KUEHNE + NAGEL GROUP","Approved","Green","","","","","Review","","","null","","","","SWITZERLAND","Existing to Bank","","Shreyash Sunil Dahale","2020154","CH","CRQ v3","","","","","1729008000","","","28/04/2024 07:46:34","27/08/2024 09:20:03"
"24207","11164837","LNAME11164837","Transportation and Storage","990030751","FEDEX CORP","Review by RM","Green","","","","","Review","","","null","","","","UNITED STATES OF AMERICA","Existing to Bank","","Shreyash Sunil Dahale","2020154","US","CRQ v3","","","","","1730073600","","","28/04/2024 08:43:40","30/08/2024 06:28:01"
"24224","11018713","CROWN WORLDWIDE (HK) LIMITED","Transportation and Storage","990002424","CROWN WORLDWIDE","Approved","Green","","","","","Review","","","The company does not disclose a group-level target for reducing its emissions but plans to set a net-zero target in Q4 2024. Thus, we are unable to comment on progress against the alignment plan.","","","","HONG KONG","Existing to Bank","","Monalisa Banerjee","1563645","HK","CRQ v3","","","","","1730073600","","","28/04/2024 09:53:19","14/08/2024 02:59:46"
"24343","11317224","LNAME11317224","T & S - Aviation","990095491","AIR ARABIA","Approved","Green","","","","","Review","","","As part of the additional analysis, the company has not disclosed quantitative targets relevant to emission reductions. Hence, we are unable to comment on progress against the alignment plan.","","","","UNITED ARAB EMIRATES","Existing to Bank","","Shreyash Sunil Dahale","2020154","AE","CRQ v3","","","","","1729180800","","","29/04/2024 12:54:43","23/08/2024 08:18:56"
"24354","13965421","RADIANCE MH SOLAR PARK PRIVATE LIMITED","Utilities","990375723","RADIANCE RENEWABLES PRIVATE LIMITED","Approved","Green","","","","","Review","null null","null","In the BCA P2, to evaluate the financial implications of extreme heat levels on the plant's locations and discuss how its efficiency levels could be impaired during heatwave events","","","","INDIA","Existing to Bank","","Kamila Waclawska","1632774","IN","CRQ v3","","","","","1729209600","","","29/04/2024 13:16:28","05/08/2024 06:44:52"
"24460","13803679","SHENZHEN CHUANGWEI-RGB ELECTRONICS CO.,LTD","Technology Hardware & Equipment","990046131","SKYWORTH","Approved","Green","","","","","Review","","","We cannot measure progress against the target, as the company has only disclosed its support for China’s 2060 carbon-neutrality goal.","","","","CHINA","Existing to Bank","","Shreyash Sunil Dahale","2020154","CN","CRQ v3","","","","","1729209600","","","29/04/2024 14:58:30","19/08/2024 08:58:06"
"24547","13884696","RELIANCE INTERNATIONAL LIMITED","Commodity Traders","990034049","MUKESH AMBANI GROUP","Approved","Amber","","","","","Review","","","The company has announced a net-zero target for 2035 (with a 2020 base year) covering Scope 1 & 2 emissions. Based on the disclosed data in the annual report, it has been making steady progress towards this goal, achieving 7.58% of its targeted reduction as of the reporting year (FY2022-23).","","","","UNITED ARAB EMIRATES","Existing to Bank","","Abhisek  Joardar","1668812","AE","CRQ v3","","","","","1730073600","","","02/05/2024 00:56:02","24/09/2024 08:51:57"
"24562","11092319","LNAME11092319","Coal Producers","990003556","BANPU GROUP","Approved","Red","","","","","Review","null null","null","Comment on why 2025 Emissions Intensity target for the mining business is higher than recent years' (2019-23) actual achievement. Refer page 57 of client's 2023 Sustainability Report.","","Sivasankar, Giridhar","1410763","THAILAND","Existing to Bank","","Devika Rose Roy","2001769","TH","CRQ v3","","","","","1729008000","","","02/05/2024 02:01:28","08/08/2024 10:23:49"
"24644","13993971","Project Grand Bidco (UK) Limited","Utilities","","","Approved","Amber","","","","","New","null null","null","While refreshing CRA with full ISIC, please enage with the client to understand if they acknolwedge physical risk, and have insurance coverage on their key assets ( to cover for asset damage and business disruption)","","","","UNITED KINGDOM","New to Bank","","V Kavya Gowri","2006519","GB","CRQ v3","","","","","1730044800","","","14/05/2024 14:04:52","20/05/2024 08:46:31"
"24651","13977616","REPSOL SA","O&G Producer","990372981","REPSOL...","Approved","Red","","","","","New","null null","null","Recommendation for 3-6months time ot request an Ad-hoc ETB CRA to get a more accurate assessment of Repsol, given it is a large O&G client in our portfolio.","","Rouse, Elliott","1489063","SPAIN","New to Bank","","Klaudia Muszynska","2001097","DE","CRQ v3","","","","","1729958400","","","17/05/2024 06:36:39","14/06/2024 09:36:21"
"24726","","","","","","Approved","Amber","","","","","New","null null","null","Recommend performing analysis of the emissions impact from traditional infrastructure business and understand what portion of the overall revenue portfolio this contributes to, to see if they are more or less exposure to climate carbon costs.","","","","","New to Bank","","Renjith  Scariah","1540001","","CRQ v3","","","","","1729008000","","","03/06/2024 11:07:05","07/07/2024 20:39:55"
"24789","","","","","","Approved","Amber","","","","","New","null null","null","Recommend to understand what the potential costs for fleet modernisation have been previously and estimate possible future costs to retrofit / upgrade remaining fleet of higher emitting aircraft.","","","","","New to Bank","","Devika Rose Roy","2001769","","CRQ v3","","","","","1729209600","","","27/06/2024 16:28:47","22/07/2024 15:29:02"
"24810","","","","","","Approved","Amber","","","","","New","null null","null","In the BCA P2, to evaluate the financial impact (either qualitatively or quantitatively) of the Indonesia carbon tax and transmission channels from higher heat levels impact the plant's location (making reference to current efficiency levels of the plant)","","","","","Existing to Bank","","Abhisek  Joardar","1668812","","CRQ v3","","","","","1729180800","","","08/07/2024 08:30:52","07/08/2024 08:44:24"
"25429","11207447","ABU DHABI NATIONAL OIL COMPANY (ADNOC)","O&G Producer","990024456","UNITED ARAB EMIRATES GOVERNMENT","Approved","Amber","","","","","Review","null null","null","- BCA to comment on the financing plans to undertake the transition as per the transition plan of the company -- Have the capex requirements been included in the projections?","","","","UNITED ARAB EMIRATES","Existing to Bank","","V Kavya Gowri","2006519","AE","CRQ v3","","","","","1729958400","","","07/08/2024 16:02:10","16/10/2024 11:14:12"
"25485","11018609","CTMA HOLDINGS LIMITED","CRE","990001725","CTMA","Advisor Review in Progress","Red","","","","","Review","null null","null","Q. HK has high reltively high physical risk, when is the company going to assess the impact of physical risk on its business, and setup an adaptation plan ? Please engage with client for the CARTs (and for this). This needs to be included in the BCA","","","","HONG KONG","Existing to Bank","","Shubham Harsh","2008896","HK","CRQ v3","","","","","1730044800","","","08/08/2024 08:04:52","23/10/2024 11:41:46"
"25541","13093729","SUMMIT ASIA PACIFIC PTE. LTD.","Commodity Traders","990012817","SUMMIT GROUP","Approved","Green","","","","","Review","null null","null","Recommended to understand the portion of revenues generated from refining activities vs. non emission intensity ones, to establish overall reliance and risk.","","","","SINGAPORE","Existing to Bank","","Yvonne  Jen","1600990","SG","CRQ v3","","","","","1729987200","","","08/08/2024 10:18:36","15/10/2024 07:58:00"
"25707","13941029","XCMG BRASIL INDUSTRIA LTDA","Other Capital Goods","990160751","XCMG GROUP CONSTRUCTION MACHINERY CO., LTD","Approved","Green","","","","","Review","","","Customized Transition risk trigger :  To enquire the company about quantifiable GHG reduction targets along with progress as well as impact of transition risks on their business.","","","","BRAZIL","Existing to Bank","","Parna Goswami","2020610","US","CRQ v3","","","","","1730044800","","","09/08/2024 10:16:09","03/10/2024 17:28:05"
"25870","11160307","CHINA POWER INTERNATIONAL DEVELOPMENT LIMITED","Utilities","990046010","STATE POWER INVESTMENT CORPORATION","Review by RM","Red","","","","","Review","Harshvardhan V","1493184","What is client's plan with regards to its thermal capcity -- Currently it not used for generation but is it expected to in the future ?  Are there any plans to wind down on the coal capacity.","","","","CHINA","Existing to Bank","","Ewa Baran","1663704","CN","CRQ v3","","","","","1730044800","","","19/08/2024 12:36:45","20/10/2024 23:19:54"
"25952","","","","","","Approved","Amber","","","","","New","null null","null","Test","","","","","New to Bank","","Vallabhi Vishwas Pai","2019328","","CRQ v3","","","","","1729008000","","","21/08/2024 08:09:16","03/09/2024 08:27:50"
"25954","","","","","","Review by RM","Red","","","","","New","null null","null","Recommend discussing with client future investment into further emissions reductions measures such as CCUS or production efficiencies.","","","","","Existing to Bank","","Devika Rose Roy","2001769","","CRQ v3","","","","","1729036800","","","21/08/2024 12:21:19","05/09/2024 11:21:08"
"25966","","","","","","Rejected to Maker","Green","","","","","New","Tysall-Blay Georgia","1515588","Review complete and in agreement with the Green rating. In line with CRQ, that there is low risk from a transition risk and credible transition plan perspective due to the nature of the project being supported (construction of two solar power generation sites).  Key risk for the sites is due to extreme flood risk at Apex site, for which a RT has been implemented. It is also mentioned that intensity and frequency of hailstorm and tornado is high. These risks have the potential to impact on client's credit, although there seems to be some level of liability insurance in place for the projects.","","","","","New to Bank","","Yvonne  Jen","1600990","","CRQ v3","","","","","1730073600","","","26/08/2024 14:35:03","23/10/2024 15:46:22"
"25989","11693780","AELITE LOGISTICS & MARKETING PRIVATE LIMITED","Agri Producers","990376713","Aelite Logistics & Marketing Private Limited","Review by RM","Green","","","","","New","Shuk Fan Liu","1551380","Added additionam analysis sc","","","","INDIA","Existing to Bank","","Monalisa Banerjee","1563645","IN","CRQ v3","","","","","1730044800","","","02/09/2024 08:14:11","15/10/2024 08:17:01"
